id,subreddit,title,selftext,time,score,num_comments
1gqr630,handbags,Dark Brown Shoulder Bag Recs?,"Hi all!

Unfortunately I don't know much about bags, and so would appreciate any recommendations! I'm looking for a deep dark brown leather shoulder bag with gold hardware. I want a zipper, minimal branding, and I like a structured/semi-structured look (but it's not a must!). My friends and I have been looking for ages, but I still haven't found a bag that's ""just right,"" so I would appreciate any suggestions. I know a lot of people have been looking for dark brown bags for fall, so I've been checking those posts and have scoured through a lot of the more popular sites on here (Polene, Strathberry, Songmont, etc.), but I still haven't found one I really loved, so I welcome any niche recs as well!

Here are a few of my running favorites and my thoughts on them - I'm hoping to keep cost under $500, if possible!

* [Verafied hobo bag](https://verafiedny.com/products/gold-chocolate-hobo-bag?variant=47652190650675&currency=USD&utm_medium=product_sync&utm_source=google&utm_content=sag_organic&utm_campaign=sag_organic&gad_source=1&gbraid=0AAAAA9pwGbILTuul8uO-OwY53h1AwaLAB&gclid=Cj0KCQjwgL-3BhDnARIsAL6KZ6-M1djx_mVRgL08LmbdNe9O_O7nECW5-8QNtZ-HT_7g9GXBrHfSnPsaAsNvEALw_wcB) \- this is probably my top contender right now: I love the lock and key!
* [Coach Brooklyn bag](https://www.coach.com/products/brooklyn-shoulder-bag-23/CW614.html?frp=CW614+B4%2FBK) \- I love this one, and if it had a zipper I would get it no questions asked. But as it is, I worry both about the clasp and the fact that pretty much everyone will have one of these - hoping for something a little less trendy so that it won't look out of place in a few years!
* [Freja Roma bag](https://frejanyc.com/products/roma-bag-espresso) \- this one is maybe a little on the boring side, but super cute and classic: that said, it's vegan leather. I don't know anything about it, but is this a fair price for vegan leather, and would it last? I've also heard bad things about their hardware.
* [Coach Cary bag](https://www.bloomingdales.com/shop/product/coach-cary-crossbody?ID=5096238&CategoryID=1004772) \- I love Coach! I also love their maple color, but that said, a lot of their bags have a little too much branding for me (I don't like the giant C on the tabby bags right now- I have an older one that doesn't have that, and it's my favorite bag of all time!). I know people like the Juliet and Junos, and they are super cute but for some reason I'm just not crazy about them. That said, those are both options I'm considering as well
* [Vince Camuto](https://www.vincecamuto.com/products/vince-camuto-maire-shoulder-bag-sandalwood?variant=45732711825575&currency=USD&utm_medium=product_sync&utm_source=google&utm_content=sag_organic&utm_campaign=sag_organic&utm_source=google&utm_medium=cpc&utm_campaign=21594463675&utm_content=%7C&gad_source=1&gclid=EAIaIQobChMI5JfwqPDtiAMV1DfUAR2XyxHWEAQYCCABEgKgFvD_BwE) \- I'm not sure about the quality of this brand, but for some reason I really like the reverse triangle shape (sorry, I'm sure there's a much fancier name) and the coin. However, again I don't like that it's just a magnetic clasp.
* [Manu Atelier](https://manuatelier.com/products/three-zipped-baguette-deep-brown) \- this is cute and I like that it's a little different, but the zippers are way too long and would drive me crazy

To be honest, what I really want is a Demellier Tokyo bag or something very like that. They have [this one](https://demellierlondon.com/products/the-tokyo-mocha-shearling-mocha-smooth?variant=45536897532078) in mocha, and I found another one somewhere in suede, but I don't like the shearling or suede. I'd just love the mocha color in actual leather, if that exists somewhere! If not, I'd appreciate any recommendations for anything similar.

Thank you so much for your help!! I've been driving myself and my laptop crazy with this (I have like 50 different tabs of bags open), and I literally made this reddit account exactly for this after having held out for years. Any recommendations or thoughts would be much appreciated!

",2024-11-13 23:43:30+00:00,5,18
1gqmhsi,handbags,Coach Brooklyn in dark ruby - any hope?,"Any idea if Coach will restock their Brooklyn in dark ruby? I’ve been waiting for a while and it seems impossible to find it. Does it usually happen with this brand to restock? Would be hear to here for any simular experience! 

",2024-11-13 20:21:18+00:00,4,1
1gqbcy4,handbags,Shoulder/Cross body black leather bag,"Hi everyone,

I am looking for a shoulder/cross body black leather bag with gold hardware and would love some suggestions! I am in Europe and have a budget of 400 euros (hoping for a lot less or scoring something great in the black friday sales).

I would like something that would be a great everyday bag, but also for going out. Medium sized, but on the smaller side?

For reference:

* I like the coach soft tabby, but I would prefer it if the bag had a zipper.
* A couple of months ago, I was obsessed with the tabby 26, but not anymore. The logo might be too big for me...
* I **love** the Loewe puzzle bag, but it's out of budget. Same thing goes for the Bottega Andiamo.
* I like the designs of JW PEI (but it's not leather) and APC, but I have yet to find the one.

Any suggestions would be greatly appreciated!",2024-11-13 12:04:59+00:00,1,10
1gq8tvq,handbags,New work bag😍,"Just received this beauty today. I got her on an early black friday discount (saved around 40%!) I have been looking for a hobo style work bag for a while and the Brooklyn 39 ticked all my boxes. Thank you to this sub for introducing me to this bag as Coach is not that known where I live. So happy with it in real life - the leather is amazing and the size is perfect for my needs.

Time to give my trusted mulberry bayswater tote a well deserved break after 5 years and of daily wear. It looks almost new though - highly recommend. ",2024-11-13 09:06:31+00:00,44,16
1gpy8pw,handbags,Help me choose an everyday bag!,"I’m kinda rlly torn between the Ashton or tabby, but im afraid that the Ashton may be too small for me and the tabby I might need a lil convincing because of the price 😅",2024-11-12 23:03:55+00:00,5,3
1gpshcd,handbags,My Collection ,"Hello beautiful friends on this amazing sub, here is my collection. 

What styles/colours should I add to this family? 

Pic 1: 

1st Row, L to R: YSL Envelope WOC, Gucci Marmont small, D&G Sicily Medium 

2nd Row, L to R: Celine classic box bag in Camel with contrast stitching, Dior Lady Dior medium in ombré blue, Prada Galleria medium 

Pic 2: 

1st Row: Aspinal of London Lottie in mini

2nd Row: Tory Burch Kira pleated convertible in small, Coach Tabby 26

3rd Row: Demellier London Venice small (or mini?), Polene Numero Sept in Taupe ",2024-11-12 19:02:48+00:00,264,42
1gp62ju,handbags,Bag so nice I bought it twice! 🥰😍(In 2  different sizes) ,"(Pretty please ignore my raggedy sweatshirt sleeve it’s cleaning day today and I forgot to take it off😂💀) 


I bought the Brooklyn 28 in ruby red when it first came out, and while I really love the shape and I use it very often, I found it didn’t quite hold everything I needed🥺.  I recently got a higher position at a new job and so I decided to pull the trigger on the 39! I also and a big collection of charms so I dressed them up all pretty for some pictures!🥰❤️ thoughts? what do you all think of the brooklyns? How do you all dress up your bags?",2024-11-11 23:05:49+00:00,161,12
1gp5odp,handbags,"My Handbag Archive, The Lucky 13 ✨","As a handbag obsessed person, I’ve so far been able to narrow down collection to 13 handbags. I’ve sold some, given some away, and even returned some. But these 13 have truly made an impact in my overall lifestyle and I cannot be happier! I think this is what you call purse peace (for now 🤪)? A lot of these purchases were inspired by this sub, and I’m eternally grateful to have found this community. 😭🫶

1. Kate Spade 3D Flora Crossbody
2. Vintage Louis Vuitton Epi St. Cloud GM (1990)
3. Furla Mini Net Tote in Mineral Green
4. Mulberry Small Iris in Degrade Blue Ombré
5. Kate Spade Sam Icon Nylon in Pink
6. Parody handbag, Birkland Signature Kelly
7. Coach Quilted Tabby 26 in Black 
8. Allsaints Hannah Tote
9. Vintage Louis Vuitton Speedy 30 (1996)
10. Vintage Louis Vuitton Alma (2001)
11. Vintage Louis Vuitton Monceau (1991)
12. Louis Vuitton OG Bumbag
13. Coach Long Rowan in Maple",2024-11-11 22:49:16+00:00,55,6
1gnrtz9,handbags,Need rec for a purse..,"Hi lovely people,

I need some recommendations for a bag that has the look similar to [Coach Brooklyn 28](https://www.coach.com/products/brooklyn-shoulder-bag-28/CU068-B4%2FBK.html?COHNA=true&cid=S_GPLACU068&ogmap=PLA%7CRTN%7CGOOG%7CSTND%7Cm%7CSITEWIDE%7CRetail%7CCoach_RTL_Google_PLA_Signal_NA_Brand_National_Pmax_Shine_Test%7CShopping_Smart_Brand%7C%7C20449355262%7C%7CUS&utm_source=google&utm_medium=cpc&utm_campaign=Coach_RTL_Google_PLA_Signal_NA_Brand_National_Pmax_Shine_Test&utm_id=go_cmp-20449355262_adg-_ad-__dev-m_ext-_prd-CU068%20B4%2FBK_sig-Cj0KCQiArby5BhCDARIsAIJvjIT680ygFOcrPb-P8i7Pi9JQnUoLKGT-0Q_tFh-FGeJW6xOS7WfFnjMaArVbEALw_wcB&gad_source=1&gclid=Cj0KCQiArby5BhCDARIsAIJvjIT680ygFOcrPb-P8i7Pi9JQnUoLKGT-0Q_tFh-FGeJW6xOS7WfFnjMaArVbEALw_wcB&gclsrc=aw.ds) but is ""zipped"" to keep contents in. Pref more or less similar price point. (Max no more than 1k)

I love the Brooklyn 28 but hate how open top is, would be perfect with zippers. I would love to hear any recs for similar bag.

Looking for casual, ""goes w every outfit"", lowkey luxury kinda bag that holds a good amount. 

Appreciate any suggestion, cheers! :)",2024-11-10 03:45:03+00:00,2,11
1gnh1wd,handbags,My mostly Coach collection,"From left to right: 
Betsey Johnson black leather bag
Coach Black pillow Madison
Coach Black Willow Tote w. Teddy charm 
Coach small black wallet
Juicy Couture Black velvet bag 
Coach swing bag in black monogram w. knock off cherry charm from Amazon
Coach Dark Ruby Brooklyn 39
Coach black essential cosmetic pouch 
Coach outlet blue bag c.2010s
Juicy Couture pink small wallet 
Star Wars Stormtrooper top handle 

Some of these were gifted and I’m not sure of the names. Most recent purchase is the Brooklyn. I love seeing them all together. Bonus cat tax✨",2024-11-09 18:52:58+00:00,79,1
1gn9q4j,handbags,Phillip Lim Pashli bag,"I recently gave in and bought the Pashli light grey textured bag, because it was on sale and thought it would be really awesome versatile small bag. But let me tell you, I rarely feel so disappointed having immediately a big NO lighting up in my brain, but when I opened the box, this was one of those times. Immediately sent it back, it looked so ugly in real life, the crinkly leather texture and the color just seemed so icky to me. 
Pic for reference, not mine since I was so bummed out, I didn't even want to see it longer than 30 seconds, not to mention take a photo :D 
I guess I just am a smooth leather kinda girl (my favorite smooth leather bags I own that I can't stop swooning over are the Coach novelty Moon bag and the pillow tabby). Have you ever felt as disappointed about a bag and what was it? 
",2024-11-09 13:07:29+00:00,9,1
1gmkglf,handbags,I'm considering to redesign this bag I made two years back. ,"Whenever I see Coach Brooklyn on this subreddit, I'm reminded of a bag I made two years ago. Both designs are quite basic, sharing some similarities. As this was one of my first bag designs, I’m considering building a refined version.
I’m planning a few key changes for the new bag:
 * Plain Stitching: I’ve received feedback about the exposed zig-zag stitching on the sides, as it's more susceptible to snagging on sharp edges. I'll switch to a more durable plain stitch.
 * Brass Feet: Given the bag's hard bottom, I believe adding brass feet would be a practical and stylish upgrade, allowing it to stand upright.
 * Straight Zippers: The current design features zippers sewn onto curved leather pieces. I'll simplify this by using straight-cut leather sides, making the zippers easier to operate.
 * Adjustable Handles: I plan to incorporate longer, adjustable handles with brass buckles for both functionality and aesthetic appeal. Additionally, I'll refine the attachment point of the handles, which currently appears a bit cluttered.
* Painted edges 
I'd love to hear your thoughts and suggestions on these changes. Thank you!",2024-11-08 14:58:55+00:00,20,11
1gmen6x,handbags,Alternative to Coach Brooklyn 28? ,"What do you guys think as this Coccinelle bag as a ‘dupe’ for the coach Brooklyn 28? Any better alternatives? 

Also, has anyone tried Coccinelle/ are they good quality? ",2024-11-08 09:23:18+00:00,2,9
1gm2ypf,handbags,Even more minimal alternative to Coach Brooklyn 28 ,"Not sure if this is where I should post this. I am a fan of very minimal handbags with little to no hardware or logos. Examples: Building Block (RIP), Bubo Handmade, Przywara Strzalka. 

I like the overall shape of the Coach Brooklyn 28 but am looking for an even more minimal alternative with absolutely no logo/brand name, no exterior hardware, and made with real leather. The Candy hobo from Mansur Gavriel unfortunately does have a tiny exterior logo/brand name (I’m not interested in the suede version). 

I am new to this community so I’m open to any pointers or suggestions 😇",2024-11-07 22:24:03+00:00,1,3
1gl1rf0,handbags,If you were treating yourself to a new bag - what would you pick ? ,"I’m looking for a new every day leather bag. The coach Brooklyn has the look I love but why WHY are we so against zippers ?! I hate open bags and open totes. It’s the only thing stopping me from buying it. I’m not really a bag within a bag person..I just gonna throw my stuff in my bag and hope for the best. 

Under $400, what would you grab? Perhaps my indecisiveness is because nothing is really screaming “yes bring me home”. 

I’ve eyed the Kate spade dumpling but I don’t like the handles - same reason I don’t want the Lana even though I love the shape of both. 


I’ve looked at Aimee kestenberg but I’m on the fence because I don’t see her posted a lot so I know nothing about the quality. Cuyana leather looks so soft in the photos I’ve seen online - but I’m also only 5’2” and don’t want to look like a total clown. Also I feel like a tote is just a bit too big for an every day carry.

I’ve also looked at the madewell essential curve. There’s this burgundy suede that is TDF but..idk. ",2024-11-06 15:57:40+00:00,29,31
1gkkqnb,handbags,Gold Or Silver? ,"I need a black bag that is more casual , not “in your face” high end luxury, but still good quality. I decided to go for the Coach quilted tabby 20 since I love the mini chanel flap but can’t justify the current price and I felt like this looked similar enough. I just can’t decide on the hardware! if anybody has pics or modshots that would be super helpful ☺️ since my nearest store doesn’t have them in stock. ",2024-11-05 23:35:48+00:00,1,12
1gkhnjx,handbags,US American Bag Charm of the day...,"My new coach Brooklyn 28 & Bear charm...with bonus early voter sticker. Trying not to go crazy before the end of the day, lol. I'll probably peel the sticker off eventually but it was a perfect fit on the little luggage tag. ",2024-11-05 21:19:36+00:00,13,1
1gjw99a,handbags,Would the Brooklyn 39 make a good mom bag/diaper bag?,"Really considering purchasing the Coach Brooklyn 39 to use as a diaper bag/mom purse. I considered the Coach baby bag, but really don’t like the nylon and am very set on leather. What I love most about the Brooklyn 39 is its size and how slouchy/unstructured it looks..but I’m also worried that might also be what makes it not the best choice for a mom bag. Does anyone who owns it have any thoughts?",2024-11-05 02:22:04+00:00,2,13
1gjkupe,handbags,Need help finding a gift under $200 for my sister,"My sister has been getting into bags between her seeing my collection and me and my husband gifting her a few nice bags over the past few years. She recently told me she’s been wanting a bag in this shade of brown (doesn’t necessarily have to be the Tabby), and my husband and I are thinking of getting her one for Christmas hopefully in a lower budget range around $200 or less. She already has a black Mario Valentino studded crossbody and a cream colored Jimmy Choo camera bag.

Does anyone have any suggestions? Her only requirements are 
Shoulder or crossbody
Not too big (she considers tote sizes too big)
This dark brown color",2024-11-04 18:06:47+00:00,4,9
1gi6z26,handbags,Coach Brooklyn 39 with Cherry Charm🍒,"Was somewhat undecided on this bag at first because it is quite big. But I love it. It’s so good for errands/travel. It’s become my everyday bag this fall! And I love the cherry charm so much. The leather is gorgeous, the snap closure is nice and strong. I’ll have this piece for a very long time. ",2024-11-02 21:31:01+00:00,55,8
1gi0vjk,handbags,Taking the purple tabby out today,I only use this bag when I don't need to carry much..,2024-11-02 16:54:42+00:00,142,5
1ghcn9h,handbags,How to tell if a bag is just trendy or timeless?,"There are always some bags that are super popular on social media (i.e. Polene bags, Coach Brooklyn 28, Coach swing zip, etc) and I'm always super tempted to buy them all based on the hype/rave reviews! But I can't tell if these bags are truly awesome or if we just perceive them as desirable since *everyone* seems to love them on insta/tik tok. 

I recently bought a bunch of bags that are hyped up, and while I truly enjoy these bags now, I don't know if I'll regret these purchases next year if they're not ""trendy"" anymore. Is there a way to tell if a bag is just trendy or if it's truly timeless? or is there no way to tell 🙃",2024-11-01 18:41:52+00:00,0,5
1ggfu41,handbags,Looking for an every day bag!,"Here’s my criteria:

Sand/nude color
Able to wear over the shoulder (bonus if it has a long crossbody strap as well, but I don’t want a strictly crossbody bag)
Something with some sort of closure (zipper preferred but magnet would be fine
Budget- prefer to spend less on this bag since I’m planning a bigger purchase for a black evening bag as well. Maybe less than $500? Willing to do around $1200 if it’s a luxury brand.
Probably something a small/medium size. Big enough to fit keys, wallet, AirPods, body spray, hand sanitizer etc. But not the size of a tote.

I’ve been gravitating toward slouchy hobo styles for an everyday bag with not as much structure. Thinking maybe something like a Coach Brooklyn. If money were no object, I love something like the Givenchy Voyou in medium. If anyone has either of these bags I’d love to know how they work for you!

Thanks!!!
",2024-10-31 14:27:49+00:00,3,17
1ggb7cw,handbags,Views on the Tabby in Burgundy ,"Hi fellow afficiandos,

My birthday is around the corner and I am thinking of buying the Coach Tabby shoulder bag in Burgundy. 

I want to use it for dinners and parties. I am a careless user ( I don't want think too much and would prefer to use my bags without having to worry about how it would wear)

What do you all think? Is it a good option?
",2024-10-31 10:24:24+00:00,1,4
1gfzdzd,handbags,Help me pick colour/material!,So torn between these two Coach Brooklyn 28s - help me decide!!,2024-10-30 22:36:06+00:00,7,2
1gftxn8,handbags,Chloe Marcie Hobo or COACH Brooklyn,"Hi all! I'm at a loss, I don't know which one to choose - I know the price difference is wild in comparison, but I don't know whether to choose the Chloe Marcie Hobo or the Coach Brooklyn 39 for my birthday! 

Do anyone have any experience with the Chloe Marcie? I don't have any stores by me so I can't see it in person. I have a large Woody leather tote so I do love a Chloe. 

Or has anyone had the Brooklyn for a while and can attest to how it holds up? 

Any help would be greatly appreciated 🫶
",2024-10-30 18:42:40+00:00,9,11
1gfkms6,handbags,Brooklyn 28 in Maple - A love story,"I had this bag on pre-order from Neiman Marcus since its been sold out on the Coach website, it was set to ship before December and I was willing to wait.

I happened to run into the mall after work yesterday to make a return at Anthro, and stopped by Coach with the intention of trying the bag in a different color just to make sure it was fitting for me and looked as good in person. I walked in and THERE SHE WAS.

The SA came over and asked if I was looking for something specific, and I instantly responded ""literally this bag"" and she said they had just gotten her in that morning - what are the odds, it was fate. She got her off the shelf so I could try her out and I was instantly in love and knew I needed it immediately.

The SA was amazing and was helping me pick out a wallet and showing me different charms - they ultimately didn't have the matching wallet in the style I wanted and it was sold out online as well so she couldn't get it ordered for me yet, but I was actually able to get it on amazon. I considered a mismatched wallet for a minute but held off because I really prefer matching, and also skipped the charm for now because I'm sure I'll be back in. She got me checked out and even gave me my 10% birthday discount, when I went to pay I pulled my wallet out that matches the current rogue bag I was wearing and the SA goes ""oh I see it you ARE a matchy person"". AND I didn't know this but they monogram the tags on the bag for free in store?! Worth buying in store just for that, I honestly had a 10/10 experience and the SA was so amazing.

So I cancelled my Neiman pre-order and I just can't stop staring at this bag. She's relatively reasonably priced and super high quality, and I'm obsessed with how casual and mature this bag looks.

I also got to try on the hunter green swing bag and hamptons hobo I have been eyeing for a while now (swing zip has been in my coach cart over a year) and its a miracle I didn't walk out with one of those bags too because I'm so indecisive. Who knows maybe I will come back for one of those because both bags were stunning and the green is so beautiful in person!

[The moment I fell in love](https://preview.redd.it/0owbxs1vsvxd1.jpg?width=3024&format=pjpg&auto=webp&s=017bf7c3bd0cddf8f08e44681539865d8b507e2a)

[In all her glory](https://preview.redd.it/fqkvd8xwsvxd1.jpg?width=3024&format=pjpg&auto=webp&s=3188ab426c7704a8fe5a0bf9e9cbe50de151ba4a)

[My custom monogram!](https://preview.redd.it/em47o8hysvxd1.jpg?width=3024&format=pjpg&auto=webp&s=63113bba469d32b9acb358df8624386b80b5cee0)",2024-10-30 11:50:59+00:00,22,6
1gf0f09,handbags,Dry Cleaner Recs NYC,Hello! Any nyc cleaning recs for vintage bags that are reliable!? Recently got a few vintage bags in need of some spot cleaning and repairs (leather and denim) any recs in Manhattan or Brooklyn would be so appreciated!!! ,2024-10-29 17:35:21+00:00,3,1
