id,subreddit,title,selftext,time,score,num_comments
1hybzow,handbags,my first big girl bag !!,"the small mulberry link in teal !!!

i had initially planned to get a more neutral colour (had been eyeing up the coach brooklyn 28 in maple) but saw the mulberry in a consignment store and absolutely fell in love !!

sadly, she was a bit out of my budget, so i figured i’d keep an eye on second-hand sites and hopefully get one one day. just so happened that someone had listed theirs for sale for half the consignment store price !! it felt like it was meant to be

got her authenticated, and took her out on her first trip today, and i’m absolutely in love. she’s my treat for all my big accomplishments last year (finishing my phd thesis, passing my viva, getting a job, moving cities)

thank you all for your suggestions and help on my previous posts !! i look forward to sharing future bag purchases with you 🩵",2025-01-10 19:01:22+00:00,281,22
1hyandq,handbags,To buy or not to buy….,"I am in love with the western tabby by coach. But at almost $600 it would be the most expensive bag I own. All of my other coach bags are immaculate quality and I can afford it, it’s just a lot for a bag. What do y’all think? ",2025-01-10 18:06:03+00:00,5,1
1hxkgyj,handbags,Best Coach bag for back issues? How light is the Tabby?,"I am getting a bag for Christmas, that I still have not chosen (even though it's after Christmas!), and I am struggling to decide. I love the look of the Tabby 26 in Maple or Chalk, but am concerned it is heavy. Can anyone talk about their experience with the weight of it, or suggest a beloved Coach that is lightweight? I would love something in cream or brown without the monogram logos all over, so that I can wear it often. I have too many black bags already. Thank you for help :)",2025-01-09 19:08:10+00:00,2,1
1hx712v,handbags,Coach Brooklyn & Steve Madden ,"I purchased the Brooklyn 39 for myself using AfterPay 😅😬 They shipped it.  I should get by Monday at the latest ♥️🤌🔥 I really hope I like it.

Preordered this Steve Madden bag for my Mom.  I think she’ll love it.  She’s a huge Steve Madden fan.
",2025-01-09 06:49:47+00:00,2,4
1hw6ajr,handbags,My handbag collection,I realized when viewing the photos and after I had put all the girls away that my new Brooklyn Coach was facing the wrong way!!!,2025-01-08 00:11:03+00:00,119,10
1hvfo6h,handbags,How do I fix my stretched out Coach Brooklyn?,"I accidentally over stuffed my Brooklyn bag and one side is left with a stretched out bulge that I want to fix. I heard that filling the bag lightly with tissue paper and applying light heat from a hairdryer would do the trick.

Is that correct? Or should I follow a different method?

I understand that leather bags stretch over time, I'm just surprised how fast this one stretched (this is the first day that I took it out - live and learn). 

https://preview.redd.it/v5wdw93s3hbe1.jpg?width=3024&format=pjpg&auto=webp&s=aa1b2501a1ec2588ed3ecf499eaae230209f4f0b

https://preview.redd.it/whxy2a3s3hbe1.jpg?width=3024&format=pjpg&auto=webp&s=df78cab1497f727610e68e87e58a867f559d3e66

",2025-01-07 01:19:59+00:00,5,4
1hv99l4,handbags,The Brooklyn Bag in Sage,Been wanting this bag for a minute and sold a couple of things that I could free up some money to buy her! I love her 😍 ,2025-01-06 20:42:00+00:00,55,6
1hv32a7,handbags,Bag Recommendations,"Hey everyone,

I’m in the market for a small leather bag that I can use regularly. 

Ideally, it would be “convertible” to a crossbody but also looks nice without the longer strap. 

I’ve included examples of two bags that I already own that I feel fit this description; the Micro Hamilton Satchet from Angela Roi (which I’m absolutely adore, it’s virtually perfect, but slightly too small) and the Mini Shopper Tote from Article & Goods. 

I’ve found many different similar options online—like the Freya shoulder bag and the Clementine bag from the Horse. Plus Coach tabby bag (but above my price point)

I’m not trying to break the bank so price range I would like to keep around $300. Prefer a neutral color, not necessarily black, and gold hardware (but not a dealbreaker). 

Turning to Reddit to source opinions/recommendations! :)
",2025-01-06 16:31:36+00:00,2,6
1huydwq,handbags,Another bag with pockets like the Tabby?,"So I was hoping to buy the Quilted Tabby this year as my big purchase. But just today I have seen several tiktoks bringing to light the poor leather quality of the Quilted Tabby, in terms of the leather paint on the bottom panel peeling off. 

The Tabby is $1000 in my currency. I cannot spending that amount on a bag that will peel after 3 uses!

The main reason I love the Tabby is the number of pockets it has and how squishy/pillowy yet luxurious it looks… is there any other bag that’s similar, or with the same kind of compartments that the Tabby has?",2025-01-06 12:57:13+00:00,2,3
1huy918,handbags,Cheaper alternative to the Coach Brooklyn 39,"I absolutely love the shape of this bag, but I just don’t have £495. Has anyone seen any similar shape bags about for less than £150? I don’t mind colour. Thanks.",2025-01-06 12:49:48+00:00,2,8
1hupakr,handbags,Coach Juliet 25,"Was randomly at coach thinking about getting a versatile more daily use bag. Was browsing the tabbies when I happened to see this glazed black leather Juliet! I’d never even seen it before, but I never knew I’d want a bag almost instantly either lol. She came home with me and she’s so truly versatile. Beautiful wrinkled leather and 3 straps to dress it up or down! Coach is that girl 😍",2025-01-06 03:09:29+00:00,16,3
1huku4f,handbags,Current Overall Collection (Jan 2025),"Current Collection in slide 1
Collection from 6 months ago slide 2

Top to bottom, left to right:
1. Black - Furla Flow
2. Black - Coach Borough Bowling Bag
3. White - Furla… forgot the name lol
4. Beige - Coach Outlet Eliza
5. Silver - Osoi Toni Bag
6. Black - Coach Mini Pillow Tote
7. Black - Coach Outlet Andrea Shoulder Bag
8. Black - Coach Tabby
9. Black - Patrizia Pepe Bambi
10. Red - Random bag from Europe trip
11. Maple/brown - Coach Dinky
12. Black - Random thrifted bag
13. Off-white - Mlouye Naomi
14. Black - Mlouye Stormi
15. Black - Coach Andrea Carryall Mini
16. Beige - Strathberry Crescent
17. (slide 3) Black - Coccinelle Binxie

Favorite/worn most often: Coach Tabby
Favorite non-black bag: Mlouye Naomi

- - - - -

Certainly intriguing to see how my current collection compares to what it was (slide 2) six months ago 😊

Lots of regrets and consignments between then and now. I wouldn’t say my collection that well-curated - but it’s getting there through trials and errors of learning about what I like (vs what I “thought” I like) along the way.",2025-01-05 23:36:06+00:00,306,28
1hu8yvw,handbags,First bag of the year 🤎,"Love my new Coach Tabby Backpack in Maple color. Saw this yesterday at the mall, went home, but can't stop stop thinking about it ~ we went back the day after. My husband bought it for me as an advance birthday gift. Thank you hubby!🥹

She's perfect for my coffee girl vibe huhu isn't she lovely 🤎",2025-01-05 15:07:30+00:00,63,8
1htuwlv,handbags,my entire bag collection and what i paid for them 💕,i have a problem.,2025-01-05 02:07:11+00:00,3469,180
1htqgc3,handbags,My small Coach collection!,"I started this collection in 2016 when I bought the blue 1941 Tea Rose Saddle Bag. I went into a small amount of temporary debt for it, but no regrets! I also have one large and one small 1941 wallets. I bought these around the same time. Sadly Coach doesn’t sell these anymore 😭

I have a  blue backpack, 2 crossbody/hand bags (the tea rose and pink bag), my large blue tote bag which is my everyday carry all, and the newest addition the ruby Brooklyn bag! I absolutely love all of them.",2025-01-04 22:37:37+00:00,26,9
1htqbbi,handbags,Favorite shoulder bags under $600 that fit an iPad Pro 11in?,I really wanted the Coach Brooklyn 28 or the Willow Bucket but it was apparent in store that neither were big enough to fit my iPad. ,2025-01-04 22:31:12+00:00,2,2
1htposl,handbags,Brooklyn 28 ,"I treated myself to some new goodies today. 

I couldn’t be happier with this style, and all it fits. It’s so light and manageable!",2025-01-04 22:02:48+00:00,17,2
1ht6348,handbags,I love my new Tabby!,"After a recent job promotion and a little Christmas money, I decided to treat myself to my first major bag purchase. I had a hard time deciding what to pick, but have been eyeing the Tabby 26 bags since they came out. I’m in love. I haven’t taken it off since it arrived an hour ago. Today, she is paired with my cherry charm dupe. 

I’d love to see your Tabby bags and hear how and where you wear them! 🍒",2025-01-04 04:12:59+00:00,20,1
1hstno3,handbags,Husband Bought Me THE Brooklyn Shoulder Bag!! ,Hi everyone! Husband bought me the Brooklyn Shoulder Coach bag for Christmas in the suede 😩 I’ve been using her for over a week now and I’m absolutely in love!! ,2025-01-03 18:44:02+00:00,189,10
1hsqcrd,handbags,Finally got myself a Tabby!,"I’ve been a long time sub lurker and am excited to post for the first time. I wanted a bag from Tabby collection for a while now and finally got myself this 20 beauty! Not only it’s my favorite colour, it was also 30% off! Best early birthday gift ever! 🥳",2025-01-03 16:28:37+00:00,73,6
1hspz6s,handbags,Coach Tabby Dark Neutral 26/20,"I saw this bag mid 2024 at coach but decided to go for a different one. I have not stopped thinking about her since, and has become harder and harder to find. The only places i have found her on sale is Coach Italy (I live in Australia and they dont ship internationally) and Cettire (in 20, thoughts on purchasing from there?) 
I saw one on depop that was swiftly sold after sending a heartfelt message about my need for this bag in my life. 
Any help will be greatly appreciated!!! 💕",2025-01-03 16:12:20+00:00,4,7
1hsdn3m,handbags,Help I think I ruined my coach tabby!!,I accidentally got my coach tabby bag soaked wet and have been trying to dry it the past few hours with cloths and paper towels. The inside suede’s color has sorta come off on the towels and I’m worried about if the purse is just ruined forever. What do I do???,2025-01-03 04:03:38+00:00,5,4
1hs0ky7,handbags,Help me find the perfect bag?,"I’m looking for a bag that serves as an in-between between my super casual “mom” bag (Longchamp or random canvas backpack depending on activity) and my “look at me I’m cute” bag (Coach Tabby 26 but this is way too small even for when I’m just being cute). 

I need something to wear when I’m “look at me I’m cute” but I also need to carry wipes, change of toddler clothes, my stuff, plus my husband’s phone, car keys, and my kindle. It needs to be lightweight and easy to carry. I prefer top handles with a slouch but still structured and long strap. 

Ideally I’d stay under $1000 and be brand new. I honestly really like the Speedy Bandolier in Damier Ebene but I just can’t do the spend.  I like the slouchy look of it once it starts to break down and honestly this vibe is what I’m looking for that I can’t seem to find in something else. 


Styles I like but I just can’t pull the trigger on: Coach Lana 23, Coach Rowan Large, Coach Mollie Tote 25, Coach Brooklyn, Swing Zip, Cuyana The Mini System Tote, Cuyana The Double Loop

Mansur Gravel: I love the styles but didn’t see anything that feels right for this. 


I know, I’m kinda a mess. ",2025-01-02 18:28:53+00:00,4,7
1hr8r7z,handbags,Help me choose the colour! 🥹,,2025-01-01 18:19:36+00:00,24,31
1hr5jkc,handbags,Coach vs Coach Outlet,Can anyone tell me the difference? I want a Brooklyn 28 in maple and saw that it’s listed on Coach Outlet but out of stock on Coach. It’s also not discounted on the Outlet so I’m confused. Will it be the same bag as ordering from their regular website? Thanks! ,2025-01-01 15:52:46+00:00,1,3
1hr23u7,handbags,Coach In Store,"Hey there and Happy New Year! 

I just discovered this wonderful community and am totally new to the ‘serious handbag game’, so please excuse me, if my question seems silly. 

I’m thinking about investing in a Coach Brooklyn bag. Since my preferred color maple is sold out online (Germany) I was wondering if there is a chance to find Coach bags in store somewhere. I don’t think that Düsseldorf has a Coach store, but are there any stockists in town where I could try my luck? ",2025-01-01 12:33:34+00:00,2,3
1hqroso,handbags,Grabbed the coach brooklyn bag in honey brown. ,"Originally wanted maple but was out of stock when I got to coach locally. Thought this was pretty so went for it. I still want the maple too so I might get the maple as well 😂
What do you guys think of the color? ",2025-01-01 00:23:57+00:00,94,16
1hqn8uu,handbags,Did you achieve “Purse Peace” this year? Do you have bags on the radar to achieve it in 2025?,"Saw a few YouTubers going over their Purse Peace lists and thought it was interesting. Do share your bags that helped you achieve peace or the bags you’re aiming for in 2025! 

I really like the Loewe Flamenco in deerskin or the Coach Brooklyn with the snakeskin handle (if it’s real). But if I’m unable to grab them, I think I’m pretty solid… for now. ",2024-12-31 20:26:27+00:00,9,12
1hqmryp,handbags,2024 Purchases,"Officially jumped on the bag train in 2024, I’ve been using the Coach Brooklyn 28 daily since I got it in September, and I got the Coach Hampton Hobo today!!",2024-12-31 20:02:35+00:00,30,3
1hqkz0y,handbags,My collection 🤩,"Row 1: 
Dior Saddle Bag
Celine Medium Ava Triomphe
YSL Le 5 á 7
Melie Bianco Brigette 

Row 2:
Louis Vuitton Félicie Pochette
Gucci Jackie 1961
Coach Tabby 20
Staud Mini Moon Bag

Row 3: 
Melie Bianco Willow Bag
Coach Eliza Shoulder Bag
Anthropologie Beaded Bag
Polene Numero Dix ",2024-12-31 18:36:14+00:00,175,24
1hqklwr,handbags,Burgundy Coach Western Tabby Inspired Bag (Custom Bag Review),"https://preview.redd.it/r364didm38ae1.jpg?width=4284&format=pjpg&auto=webp&s=23af098b55fad2d428533f63bf48dfc5ada94ece

For more photos please check u/raptureofsenses on reddit and [https://www.instagram.com/rivamouth2/](https://www.instagram.com/rivamouth2/) on instagram, who made this lovely bag for me! She took much better photos that are more color accurate and show the whole bag :) 

I found her through r/handbags after seeing some of the gorgeous purses she'd made for others here, particularly a burgundy Jackie inspired bag that is actually the same leather that this bag is made out of! I made an inquiry on Nov 4th, and received my bag today Dec 31st. That's already very fast and within her promised turnaround time, and especially impressive if you consider it's the holiday season! 

I have been drooling over the Western Tabby's posted here for so long, but never pulled the trigger since there wasn't a colorway that I loved and I tend to prefer gold hardware anyways. 

So in getting the chance to request my own version of the bag, I got to make it perfect for me! It's slouchier than the original in the way that I like (structured enough to have a shape, but slouchy enough that you can pack weirdly shaped things without obvious bulges), pockets on the side for airpods/hand sanitizer, slip pocket in the back for my phone, and a front pocket for easy access to keys. I personally prefer turnlocks over magnetic closures, so this bag will match others in my collection too! And of course, getting it in this lovely burgundy/maroon color with gold hardware. 

In terms of process - she is very thorough, asking for details that I hadn't even considered, and making sure that every part of the bag is to your liking. I hadn't been super clear on what kind of strap I wanted (or rather, I accidentally contradicted myself since I forgot what I had said previously), and she was so kind and accommodating and actually just went ahead and made both a shoulder strap and crossbody strap for me, which turned out to be perfect! 

Payment process and shipping was easy and transparent, and she will follow up on things with you! Responds promptly despite time difference issues, and is both kind and clear in her communication! Price wise, it was definitely comparable with the original Coach bag, and though I'm no expert on quality, I can see no flaws on close inspection, and it is sturdy, smooth, and professionally finished. From what I see on this sub from others, it looks as though her bags historically have held up very well too! Definitely worth much more than I paid for, which is why I'm not surprised (and am happy actually) that she posted on IG about raising her base prices in the new year. 

I would strongly recommend working with her, and am planning on asking for another purse after the new year (once I decide what I'm going to ask for haha). For anyone considering it, I would ESPECIALLY recommend looking into it if you're in the situation of wanting an existing bag design but with some changes to make it perfect for you. Please reach out to u/raptureofsenses , she will take good care of you! 

TL;DR: got a custom bag, it's perfect for me, process was smooth, no complaints or feedback whatsoever, recommend without reservations! ",2024-12-31 18:18:53+00:00,14,5
1hqdotu,handbags,My small (but growing) bag collection 🩷,"I seen this in the Coach bag group and had to make my own collage! 

The Alexander McQueen was my first luxury bag purchase. Still in love with her 🩷 ",2024-12-31 12:26:16+00:00,21,5
1hq2cbk,handbags,Bitten and addicted ,"Mulberry small Islington, Coach Brooklyn 28 in maple, and a vintage Etsy buy (GypsyLuLuCo). 

I’ve never had a really nice bag. My boyfriend got me the Coach bag for Christmas AND I’m in love. It’s a problem. I stare at her all the time! The maple color is gorgeous. 

After staring at my Brooklyn, I went ham and bought a bunch of bags.. a few more are on the way. I love the Mulberry so so much!! She’s so sleek and gorgeous. I’m already eyeing up another Mulberry (or 10). 

I love the Etsy buy! I wanted something more casual for summer, the shop had great reviews. I was having remorse about her until she came. She’s so cute. 

I can’t really speak to quality since I am so new to this world. I don’t know enough about leather or bags or purses or anything! but I want to learn before I make anymore purchases. I saw something I liked, I bought it, and because I’m planning on getting more I need more knowledge. 

How do you ladies take such nice pics of your purses? I love looking at all the beauties here, but I don’t know how to show mine off. 

Thank ya’ll for posting your beautiful bags and kicking my newest addiction off :) ",2024-12-31 00:41:58+00:00,183,11
1hq20iv,handbags,Coach Lana - which colour?,I’m starting a new job and can’t decide which colour to treat myself to! I already have the Coach pillow tabby in black but that’s more of an evening bag whereas this one would be more for daytime. Part of me thinks as I already have a black Coach I should go for brown but I think black is more versatile - help!,2024-12-31 00:26:24+00:00,4,5
1hpxlos,handbags,Help Me Be an Educated Buyer,"Hello to the brain trust! I am a husband trying to buy nice gifts for my wife, and after researching for some time here, I've settled on some bags I'd like to buy her in the coming years. She doesn't really go shopping for herself, but I know what sorts of things she likes, and she really appreciates it when I go shopping for her and buy her nice things. Here are some of the bags I'd like to buy her in the coming years:   
  
(1) Strathberry Nano Tote (black or bottle green);   
(2) Polene Numero Un Nano (sandlewood; camel; burgundy; textured green);   
(3) Coach Tabby 26 (white; black; red?);   
(4) The Horse Clementine (black); and  
(5) Loewe Puzzle Bag Mini (almost any single-color).   
  
I'm a pretty savvy shopper and am content to wait until the best deals come up. (I love stacking coupons with Rakuten and credit offers.) I have a few questions though, since I'm trying to figure some of this out:   
  
Question 1: What would you consider a ""good"" deal on each of these bags, assuming I'm going for a fairly popular color (e.g. black, white, or brown)?   
  
Question 2: Did the Tabby 26 ever come in red? If so, do you have one?  
  
Question 3: Are there any other money-saving tips you could share?   
  
Thanks for all the help!  ",2024-12-30 21:10:57+00:00,1,9
1hpv340,handbags,Which 5 bags would you choose to have? ,"I am working on a clothing capsule. I started to wonder what would be a bag capsule so I searched and found this. They say 5 bags minimum. And top 3 would be Tote, crossbody and a special occasion purse. 

Realistically I know I can't minimize it down to 5 bags. But, if I did these would be my 5:

2 Work bags: Cuyana Mila Satchel + Esin Akan Emma Large Leather Tote
2 Weekend bags: Coach Brooklyn 28 + Min and Mon Marino
I have no idea what I'd use for a special event purse. Sometimes of cluth / crossbody. 

What would be your 5? ",2024-12-30 19:22:13+00:00,34,33
1hpt58c,handbags,Torn between two bags,"I’ve seen both of these bags in person and loved them both, but only have the budget to buy one, so figured I’d ask for thoughts and opinions. First is the Mulberry Small Link in teal, and second is the Coach Brooklyn 28 in lime",2024-12-30 18:00:23+00:00,3,12
1hoo6s3,handbags,Help me find *the* bag!,"ISO a burdundy/dark ruby/maroon/dark cherry crossbody bad preferably with silver hardware (I can make gold work…). Looking to spend up to $300! Any recommendations are greatly appreciated (: spent today shopping and didn’t see anything I loved 

For reference, I love the Bottega Mini Loop Metal Knots in Madder brown although I wish it was more red (and in my proce range LOL). I also love the Coach Brooklyn 28 in Dark Ruby, but it's not a crossbody. 
",2024-12-29 04:34:31+00:00,2,4
1hodsc9,handbags,Advice needed please! ,"Hi all! I recently updated my everyday bag with a beautiful Mini Alexa from Mulberry (because of this sub😊) but now I don’t know what to do with my old Coach Pillow Tabby. 

As you can see, the color is all worn off. I have cleaned with a wet cloth to try to upkeep. So my question is, what would you do with this? I haven’t heard good things about sending back in to Coach to be repainted (if that’s even possible). 

Any and all advice appreciated! ",2024-12-28 19:56:14+00:00,2,4
1hnu02j,handbags,I like the bag charm trend...,"Bag of the day: Coach Soft Tabby in Ivory, adorned with bag charms from Radley and Anya Hindmarch 😉😇❤️",2024-12-28 01:01:24+00:00,66,6
1hnti69,handbags,Turned 28 last week so got myself the Brooklyn 28 in sage.....obsessed 💚🌿🎁🎂,"this is THE COMFIEST bag I've ever had, the strap drop fits perfectly on my shoulder without slipping and you can comfortably move your arms around or have them at your sides. the color is stunning in person, pictures don't do her justice! 🌱 and I know she needs more charms, they're in the mail 📬",2024-12-28 00:36:26+00:00,384,41
1hmv7d3,handbags,Mom’s first coach bag!,"I previously posted on this subreddit about my mom falling in love with the Brooklyn 28 coach bag but wasn’t comfortable with me purchasing it as her Christmas present, however I ended up getting the bag for her.

I told her it technically didn’t purchase full price since they gave a percent off since it was the floor model! She absolutely loves it! Thank you to those who gave other suggestions on my previous post and happy holidays!",2024-12-26 18:58:30+00:00,69,4
1hmsjfm,handbags,Coach Brooklyn: Moisturize unlined inside?,"Just got this Coach Brooklyn bag. Been wanting it forever. I knew the inside was unlined, but I noticed that it almost looks like it's cracking. Is this normal? Is there any way to moisturize it to protect it?
 
I could just see it getting worse over time and with excessive wear. This is literally brand new. Just got it for Christmas. ",2024-12-26 16:58:17+00:00,2,4
1hmp70t,handbags,my used & abused early christmas present & my new christmas present 🎄,"got the brooklyn 39 in honey brown last month ..has now become my daily/work/sleepover/everything bag (hence the shape). the cutie 28 in sage found its way under my tree this year 🌟
i will 1000% recommend these bags to anyone who asks 😭",2024-12-26 14:16:38+00:00,44,14
1hmct76,handbags,I got a Coach ecosystem for Christmas,I've been wanting the red wine Brooklyn Bag for ages but it was sold out. I'm so happy right now!! Absolutely obsessed <33,2024-12-26 00:34:02+00:00,44,6
1hm82me,handbags,Merry Coach Xmas to me 🦖,Riya Backpack 21 In Signature Textile Jacquard and Essential slim card case in dark ruby (to match the Brooklyn 39 I bought myself a few months ago) and two Rexy bag charms. ,2024-12-25 20:14:37+00:00,27,1
1hm7mrb,handbags,Arrived in time for Christmas... ,"So I decided to go for the brooklyn over the lana and it arrived in time for Christmas.  It's a little smaller than I thought it would be and that I'm used to, but the colour is so lovely. Very happy with my first Coach. Thank you for your help in choosing her 😊",2024-12-25 19:51:36+00:00,26,3
1hm3mbt,handbags,All the bags I purchased this year ,"I purchased several bags this year and in a separate post will share which ones I said goodbye to. I sold as many as I bought.  

1. Mulberry Lana Shoulder Bag in black 
2. Fendi Lurex Denim Baguette from 2010 (pre-owned)
3. Chanel Nano Kelly in Navy
4. Coach Swing Zip in Maple
5. Loewe Flamenco Purse in Burgundy
6. Baggu X Collina Strada shoulder bag
7. Coach Tabby 26 with daisies
8. Dior Vintage Saddle Bag from 2007 (pre-owned)
9. Dior Vintage Rasta Saddle Bag from 2004
10. Fendi Simply bag mini in Black",2024-12-25 16:20:49+00:00,369,32
