id,subreddit,title,selftext,time,score,num_comments
1jwa4ek,handbags,Is it vintage coach?,"The general consensus is that it’s vintage coach. But what model? No tags that I am aware of but I found two of the same model online. This photo is from pinterest, and [this video](https://www.instagram.com/p/DCh07b4RkqN/?igsh=YndyOHN6NmZ2MWw3) is from a vintage seller on instagram. They show the inside but no markings.

",2025-04-10 22:03:34+00:00,2,1
1jw9joh,handbags,My current handbag collection? What should I add next?,"Hey everyone! I’ve been slowly building my handbag collection over the past couple of years and I feel like I’ve got a good base—now I’m trying to figure out what direction to go in next.

Here’s what I currently have:

(Top left to right)
Vintage LV Noe in GM size
Madewell tote
Polene Cyme mini
Polene numero dix

(Bottom left to right)
Vintage Chanel CC shoulder bag
Coach camera bag
YSL mini nolita
Maison Pourchet Paris sling/belt bag",2025-04-10 21:37:51+00:00,18,10
1jw31nv,handbags,Coach Lana vs Polene neuf,"Looking for an bag to take everywhere. Has to fit my phone, wallet and sunglasses. 
I really like the polene beuf in sandalwood and the coach Lanain dark brown. 
",2025-04-10 17:07:33+00:00,2,8
1jvykb4,handbags,Too gaudy?,"Question to all my handbag girlies 
I've recently gotten into handbags and have been on a constant search for a bag that I love and fits into my budget. 

After scouring poshmark, I found this vintage coach 7791 hampton satchel in good condition (at a steal!) that I loved and decided I needed to have. It's missing its strap to turn it into a crossbody which I'm fine with replacing but I knew I wanted to jazz it up a bit.

My question to all of you long time hand bag lovers, is this too gaudy? Too much? Should the chain be shorter or placed on a larger bag?

The more I look at it the more it's growing on me but I just wanted to see what others thought 😊",2025-04-10 13:58:06+00:00,15,11
1jvv4ag,handbags,Relining Coach handbag,"Hi!

This is the inside of a second hand Coach bag. What would be the best way to repair this? It seems like it’s some sort of gum stuck to the bottom that cannot be cleaned off. 

Would it be better to bring it to a tailor to replace the lining? Or bring it to Coach to repair this?",2025-04-10 11:00:33+00:00,3,6
1jvn3qx,handbags,Which bag should I buy for graduation? Thank you in advance!,,2025-04-10 02:11:15+00:00,2,19
1jvlw62,handbags,First luxury handbag(s),"Hi everyone, 
I would like to purchase my first “luxury” handbag, currently I own couple of coaches and a Kate spade, which I love. But I recently became obsessed with Chanel. My budget is $10k. I’m looking for advice, 
1. which Chanel should I purchase? 
2. Should I go to pre loved route or brand new?
3. If going the pre loved route, which websites/ pages are the most reliable?

Note: Ideally I would like to buy 2 different staple bags for different times and season. Since my budget is $10k i understand purchasing 2 chanel bags may not be possible so i open to other brand recommendations. Please any advice is appreciated. 🙏 ",2025-04-10 01:07:28+00:00,3,17
1jvhx25,handbags,In search of the perfect small black bag (with gold hardware),"Hello everyone,
I'm looking for a small black bag with gold hardware that can go from day to night. 

I've been eying the Coach Quilted Tabby 20 and the Small Gucci Marmont, but I am definitely open to more suggestions and not set on a quilted bag! Ideally the bag should have atleast two handle options (e.g. shoulder bag to crossbody)

I usually gravitate towards other colors when choosing a bag, but I found that for more formal-ish events a black bag is kind of a must have.

Please let me know if you have any suggestions for other bags or opinions on the ones I've tried on :)",2025-04-09 21:54:25+00:00,45,42
1jvh9go,handbags,They're here! Tory Burch Romy Tote and Hobo,Quick picture of my birthday gifts to myself: Tory Burch Tote regular size and Hobo small size. These are the first TB bags I've ever owned and I love them! I like her new designs and wonder if she'll experience a brand resurgence similar to Coach. ,2025-04-09 21:25:44+00:00,14,3
1jvh9dj,handbags,Vintage coach Murphy bag,"I was saving this bag fory lil one, but my husband grabbed it accidentally for our afternoon out.  So, I'm taking her for a spin.  Love, love, love!",2025-04-09 21:25:38+00:00,3,5
1jvh5rc,handbags,New spring/summer bag,"Sooo… I have a small collection to switch bags for specific events or needs or to add color, but I always have a “main bag” (easy to carry, medium capacity, handy with my basics in for everyday use both at work and errands. For reference, work’s dress code is mostly business casual. My current go-to is a coach black hobo bag, surprisingly reasonably priced that has lasted me a couple of years of very heavy use. But I’d like to switch things up for spring and summer with something in a different color and material. I ordered a bunch and have narrowed it down to two. I could purchase two in the lower end (350$tops) OR splurge in only one. Here are my 2 splurge candidates- brown suede rag and bone and blue Tory Burch. Both are comfy, seek sturdy, good size etc. (I was tempted to upload photos of the others as well, so cute, but decided to be practical. Thoughts? ",2025-04-09 21:21:23+00:00,1,2
1jvg9hl,handbags,What is hands down your most reached-for bag?,"Any brand, any style. I want to know which bag someone would have to pry from your cold, dead hands before you gave it up! 

I’m a coach girlie and my go-to is the Brooklyn 28, but starting to think I’d like to add Loewe or longchamp to the rotation…

Edit - in case anyone would like access, I’m compiling a mega spreadsheet of all our favorite bags! Will link it here and update as we get more ideas in. ",2025-04-09 20:43:14+00:00,95,161
1jvg4ub,handbags,Good school tote,"Hi, I am starting law school and I'm  wanting a nice brand tote that can comfortably fit my 15 inch long computer. Coach is my fav brand but they dont have totes that would fit my laptop, any suggestions of brands/styles similar to a plain Coach bag? Thanks! ",2025-04-09 20:37:48+00:00,1,3
1jvfeim,handbags,Any stylish/pretty bag that fits a 16inch laptop?,"I’m looking for a bag I can take to uni and to work in which I can carry my 16inch laptop. 
I was looking at the Lana Shoulder Bag from Coach but I don’t know if it will fit a 16inch laptop plus all my essentials. ",2025-04-09 20:07:10+00:00,2,8
1jvbw57,handbags,Shopping for my girlfriend,Hi y’all! I just bought my girlfriend a Strathberry midi tote bag so it’s on to the next one. I’m looking for bags with this general shape to get for her and I do like these options but I was wondering if there were other options you would know about that couple potentially be better? My budget would but up to $800 dollars. Thank you! ,2025-04-09 17:44:04+00:00,7,1
1juzyn2,handbags,wrinkles in leather ?,"helloo!
i have the cutest soho coach bag and i wanted to know how to get the wrinkles out of the leather corners!! 
i tried moisturizing but see no significant difference D:",2025-04-09 07:21:48+00:00,3,3
1jut3cx,handbags,Baby’s First Coach bag!,"I have been eyeballing a Coach tote for months now, waiting for the right moment to buy one and apparently today was it! I love how spacious it is. It’s  going to be my everyday bag AND my laptop bag when I go back to school. I’m so happy I did bought it! ",2025-04-09 00:34:21+00:00,23,3
1juszqy,handbags,Help me choose a COACH everyday driver brown bag!,"Looking for a brown bag for every day. I’m partial to the maple colour but am open to other browns that could work for every day.

Juliet Shoulder Bag in Dark Stone - Partial to the maple colour but there isn’t one in this style anymore. Love that it has a zip and generous shoulder drop!

Soft Tabby in Maple - I already have a black tabby bag (regular tabby) but heard good things about this leather and style. I like that it’s  more secure than the Brooklyn bags. Worried it’s a bit too dressy for an every day bag.

Brooklyn 28 in Maple or Honey Brown - I really do love these but don’t love the lack of security (no zip or top flap) and i think it leans trendy rather than classic. I’m a bit worried Honey Brown is too “yellow” for my skin tone (light brown/beige).

If you have any of these bags please share pictures!",2025-04-09 00:29:24+00:00,28,25
1jupw5m,handbags,Slowly building my collection - help me pick my next bag :),"Hey everyone! I’ve recently gotten into luxury bags over the past year or two, and I’ve been slowly building my collection. Right now, I have six bags from brands like JW Pei, Kate Spade, Strathberry, Michael Kors, and Coach.

I'm thinking about what to get next and have a few options in mind. Which one do you think I should go for next (purely based on looks and value for money)?",2025-04-08 22:01:55+00:00,9,33
1junsnh,handbags,DIY’d kisslock,"I had to pass on the Coach Frame bag drop (crying in broke grad student right now) and decided to try to cope by making my own kisslock shoulder bag. 

She’s giving ✨Homer Simpson in a bush✨ vibes but I love her none the less! I think next time I would add bag feet to her and use a slouchier lining(I used faux suede this time and it’s a little much). 
If anyone has any bag lining recommendations, I’m all ears! ",2025-04-08 20:32:33+00:00,22,5
1ju7n0q,handbags,Mini coach haul,"Order my bags added the chains , Coach Caleb on chain is my favorite ✨ ",2025-04-08 07:10:02+00:00,2,1
1jtxk9z,handbags,Have I reached handbag peace already?,"Some of you may remember my other posts. After over ten years of no new purses, I purchased a Mulberry Amberley and The Horse Clementine in Jan/Feb. I’m obsessed with my Clementine 100%, but I haven’t used The Amberley yet so it might be time to pass her on. 

During this hunt for a new purse I discovered this color block Coach Lana 23. It was instant love, but the only one I could find for sale was at an outrageous over retail price on posh. I waited, scouring the bsts and resales sites daily and this beauty popped up on eBay for under retail AND NWT! How lucky? 

She arrived last week and to say I’m obsessed is an understatement. She completes me. I’ve looked at some handbags since, some I really wanted, and all of them seem very meh to me now. I think I’ve found my next ten year love. That’s all. ",2025-04-07 21:59:08+00:00,400,40
1jtbhnn,handbags,Looking for a bag for 16.2 inch laptop,"Hi! I have a 2021 MacBook pro and I’m looking for a work tote/hobo style bag that will fit it. Preferably leather, and I really like coach. I find one i like but then it is only 16 inch at the top and smaller at the bottom, or meant for 14 inch computer. Let me know if you have one that you like and any recommendations! Thanks. ",2025-04-07 03:01:38+00:00,2,4
1jtazfj,handbags,My first in-store luxury bag purchase!,"About a year ago, I (23M) started my collection (should i post?), I started out with Coach wallets, then moved to briefcases and cross bodies (all Coach). Recently bought a pre-owned gucci crossbody which I LOVE but it was too small for everyday use (for my needs at least). So I decided to head to my local Gucci boutique and purchased the Small Ophidia Messenger. I was surprised how spacious she is! I'm in love, + she holds my LV wallet I bought preloved. I'm OBSESSED. ",2025-04-07 02:33:51+00:00,17,1
1jt9f3z,handbags,Minor scratch repair on Coach Handbag,"My partner got this coach handbag in the last week or so and her cat jumped on it scratching it. The flash from the camera makes the scratches a little more noticable, but depending on the angle you can definitely tell they're there.

Is there a good way to fix these scratches at all ourselves?

I've seen mixed suggestions from Google searches about the texture making it difficult, and others saying a repair kit is all you need? ",2025-04-07 01:07:26+00:00,4,3
1jt757a,handbags,TB Romy Hobo - Which color?,"Not usually a Tory Burch fan, but I’ve been looking for a large bag like this, and after seeing it at Nordstrom, the quality actually feels a lot better than any of the options I’ve been looking at from Coach or Mansur Gavriel. Really torn on which of these colors to wear… Any thoughts?",2025-04-06 23:10:19+00:00,3,3
1jt4max,handbags,"I love the miu miu rectangle bag, anyone knows a dupe, so far i have only found a coach one. Thanks!",,2025-04-06 21:10:42+00:00,3,4
1jt350l,handbags,Girlies help me find a beautiful everyday designer bag,"I have a lot of colorful bags and i need a (preferably) black everyday bag that is not too small and not big. 
I don’t need to carry laptops or iPads with me.
The pricing can be up to 3000€

Maybe some of you have some beautiful designer bags in mind (I don’t really like coach, mulberry, Kate spade etc)",2025-04-06 20:05:46+00:00,1,4
1jt1yml,handbags,Help me pick an affordable everyday bag,"I’m looking to buy an affordable everyday bag that can fit my essentials—wallet, keys, sunglasses, a couple of lippies, and perfume. I’m leaning toward black since I already have bags in tan and white.

I’ve also been eyeing one with the Coach monogram. So far, these are the options I’ve shortlisted.

These are the options I’ve shortlisted—would love your input! Which one would you pick?",2025-04-06 19:14:34+00:00,5,5
1jsxi2t,handbags,Anyone recognize this bag?,"I got this lovely little bag from family. It was purchased in Bangladesh.

I have used it as my daily purse for about three years now and it looks almost new still. I adore it and the quality must be nice. 

I was recently in a Coach store looking at bags and one of the sales people asked if my purse was vintage Coach and she just generally liked the design. 

As many handbags are made in Bangladesh I am wondering if this purse was a designer one originally but maybe had some mistake that caused it to be sold in a local market. Anyone have any leads?",2025-04-06 16:03:28+00:00,3,1
1jsv72y,handbags,Newest member of the family,So in love with the Coach Empire Carryall 34 in Brass/Maple! I bought in store and they offered to customize the tag of my bag with whatever I wanted. They recommended using my initials and I added my zodiac sign. Highly recommend purchasing in store to get the customization done! <3,2025-04-06 14:20:48+00:00,32,4
1jsiwia,handbags,Help me pick a crossbody/shoulder bag that’s good for casual outings and special occasions,"I want something that looks high quality, that can look cool with casual attire and relaxed luxe for special events. Which do you think gives off that vibe? Or maybe I already have that bag 😆 (Chloe Tess). I kind of want a box calf leather type of bag, maybe something like the Hermes Constance.

##The Idol Bag: 
I like it because of the smooth leather that’s box calf (oh patina), plus the magnet is super satisfying. But the shoulder chain strap I wish was a leather strap that can be adjusted to a shoulder strap.

##Time Square Tabby:
I like that the shoulder strap has a leather portion and it definitely can be an everyday bag as well as a special occasion bag. I also love the canvas interior. 

##Lee Radziwill Shoulder Bag:
I like that it can be adjusted as a shoulder or crossbody bag with just one strap. 

",2025-04-06 01:26:40+00:00,3,4
1jscd01,handbags,A coach purse from 20 years back and it’s still pristine. I feel like coach is just built to last. I also don’t like throwing out anything in good condition because fashion is so cyclical,,2025-04-05 20:08:04+00:00,13,1
1jscajf,handbags,Everyday leather zip top shoulder bag to fit laptop that’s not structured and similar to the photos,"Hi!
I’m looking to buy a leather shoulder bag that’ll fit my 14inch MacBook Pro. It needs to have a zip top but it doesn’t need to have a dedicated laptop sleeve. Ideally it’ll be around 14 inches wide just based on bags I’ve tried. The baggu leather shoulder bag is closest to what I’ve want that I’ve found but I’ve heard mixed things about the quality of recycled leather. I tried the coach cary and I liked the style but it took more effort than I want to get my laptop in and out.

Ideally I want one under $250 but I can go up to $400",2025-04-05 20:05:04+00:00,3,4
1jsbvz7,handbags,Which bag should I pick?,"I currently have my eye on three different bags and I keep going back and forth about which one to pull the trigger on 😭 I currently have a very small collection of one Coach Chain Tabby in Black, and the LV Felicie Pochette in the regular monogram print. I’m looking for something to add a bit more variety and interest!

I’m choosing between the following in no particular order: 
- Veronica Beard Dash Bag ($598 CAD) in Hazelwood;
- Polene Nodd in Smooth Cognac ($580 CAD);
- Strathberry Mosaic Bag in Taupe ($900 CAD).
",2025-04-05 19:47:15+00:00,4,12
1jsbf0b,handbags,Any fans of Portland Leather Goods?,"I've been considering the Coach Brooklyn bag for a little while, but something about it just wasn't quite right for me (i.e., it doesn't come in pink) so I've been on the lookout for something similar. I've been a MAJOR fan of Portland Leather Goods for a couple years now, and they recently released their Large Naomi bag in Pink Suede, and I was instantly sold on it. It is PERFECT! So soft and slouchy -- it is exactly what I was looking for.

In case you're curious, the PLG Large Naomi is 11"" x 12"" x 5"", with strap drop length of 12"". While the shape is slightly different, it is relatively comparable to the Coach Brooklyn 28 at 11"" x 11"" x 3.5"", with a strap drop length of 10.5"". Plus, the PLG bag was only $78 because I got it from their Almost Perfect line. 😅 I can't resist the opportunity to save a little money. 

Does anyone else on this sub collect Portland Leather Goods bags? Because I have several and I don't see enough people talking about it!",2025-04-05 19:26:01+00:00,866,131
1js7rod,handbags,Everyday black shoulder bag?,"Torn between these right now:
New Coach Hamptons Hobo 
Rebecca Minkoff M.A.B. Nano shoulder bag (slightly larger than the Hamptons)
Last new bag I plan to buy, just need something  midsized and black🤷🏽‍♀️",2025-04-05 16:48:07+00:00,3,6
1js60w2,handbags,Medium Summer Bag (mom friendly),"Currently using the Coach Cary. Need a replacement for the summer! Medium sized (smaller than the Cary), shoulder strap, and under $500. Give me your faves pleaseeee ",2025-04-05 15:30:08+00:00,1,4
1js5pjh,handbags,Looking for a bag or keychain thing for my 17th b day,"Was mostly looking between the coach Teri (lowkey a lil more than I'd like to spend b if it's great then I don't mind) or a lululemon keychain not the duel pouch one more of the make your own ones from pint-rest b I'm open to any other suggestions 

I'm not really sure bc I feel like I don't carry that much w me (money, lippies,perfume, mascara, gum) but I want smth that's easy for simple grab and go and good for everyday yk? So lmk thanks in advance :) ",2025-04-05 15:15:29+00:00,0,3
1js33u5,handbags,Interesting totes,"Do you know of any brands that produce patterned/printed totes? Ideally leather. No fancy features, but a zip/closure is a win. 

I love this floral tote, but it’s canvas and probably only suitable to use half the year. 

I’m not into any LVMH or Kering brands, Kate Spade, Coach, and… I hate to say this to my American friends (nothing against you personally), but I’d ideally like to avoid American brands, if possible.

Price range is up to $3000 CAD/$2000 USD/£1600 GBP.

Thank you all ❤️",2025-04-05 13:10:36+00:00,21,25
1jrv5t0,handbags,Opinions on the Lauren Ralph Lauren Tanner Shoulder Bag?,"Hi Handbag Baddies! I was browsing the Macys site and noticed this beautiful Lauren Ralph Lauren bag. It’s the Leather Medium Tanner Shoulder bag. The shape is reminiscent of styles like the Coach Brooklyn Shoulder bag and the red color caught my eye. The Macys and Ralph Lauren website mention that this bag is made from supple full grain leather. It doesn’t have a zipper but does have a dog clip closure. Unfortunately, I can’t find any reviews of this particular bag apart from the reviews on the retailer sites. Anyone have this bag or any of the Tanner line bags and can share their opinions on the leather and quality of the bag? 

I’ve been very conscious with my bag buying habits recently and haven’t bought anything since last August (and that too was just a Baggu crossbody on sale, my only bag purchase in 2024). This year, I gave away two Coach bags (the only ones I had and the only high end brand in my collection) to relatives as gifts because after the initial few uses back in 2023 and maybe once or twice in 2024, I didn’t see myself reaching for them. However, this Ralph Lauren bag is speaking to me. While red is a vivid color, I can actually see it at an accent color to most of my wardrobe and I’ve wanting a bag in this style for a while. Would greatly appreciate any reviews on this bag, thank you in advance! ",2025-04-05 04:16:49+00:00,6,3
1jrv52c,handbags,Coach Willis Bag,"Hi everyone! I’m wanting to buy a preowned black Coach Willis bag, but I’m not really sure where the best place to purchase one is. I’ve looked on eBay a little and already seen multiple listings using the same photos 😩 So any help is appreciated.",2025-04-05 04:15:38+00:00,3,2
1jrtdjq,handbags,I need it for my 14”laptop,PLEASE HELP ME ASAP!!! I want it to be durable and it should fit my 14” laptop (lenovo thinkpad),2025-04-05 02:33:47+00:00,0,1
1jrmre4,handbags,Anyone else on the vintage Coach kick?,"I’ve been slowly building a collection, including some I inherited from my mom along with a few thrift finds. Since I don’t tend to rotate my bags much, I started painting them so they would get some love haha. 

My favorite so far to paint is the court bag. Something about the shape of the top handle is really satisfying and I love doing the subtle shading on the flat leather. 

I recently picked up a red backpack too, so I’ll probably do that one next. :)
",2025-04-04 21:08:23+00:00,38,11
1jrmjfg,handbags,Help Me Choose,"The black Furla I received 20 years ago is being repaired and I need something to use in the meantime as an everyday bag. I thought I’d get something more spring/summery. I’m not super careful with my bags, and tend to use them forever. 
Coach Cashin, Furla Diamanté, Staud Pine. ",2025-04-04 20:59:24+00:00,7,11
1jrmbxt,handbags,Coach Nolita vs. Hailey Flap,Which style would you recommend and why?,2025-04-04 20:50:15+00:00,6,3
1jrj1kn,handbags,Work bag I can put my shoes in,"So I work a few days a week in an office space where I can’t really leave my shoes (partially because storage, partially because I have client meetings the rest of the week and need them!). I’m NYC based and commute via public transit and a lot of walking, so comfy shoes when commuting is a must (plus I don’t want to get crud on my shoes). 

I currently have [this tote](https://www.dagnedover.com/collections/classic-tote) from Dagne Dover, which I love for the size, the chain for my keys (lifesaver when I’m coming home and don’t want to fumble around in my bag), the pockets, and the water bottle holder. 

That being said- the bag isn’t really my style. Outside of work I tend more towards Beara Beara, Fable England, vintage Coach, London Fog, and even some more eclectic choices like a carpetbag for travel. I work in the history field so I can absolutely lean into that urge for me! I lean towards dark brown leathers and very classic styles- but it has to be able to close by zipper as well as fastening because when I travel I’ve run into pickpockets. 

What I usually have in my bag- granola bar, lipstick, concealer, compact, wallet, business cards, keys, water bottle, meds, and my kindle. I don’t need to schlep around a laptop but I do often have legal-size folders on me for documents, and sometimes do have regular books in it as well. I also usually have a small umbrella, a scarf, and some other odds and ends like a mending kit and such. My workdays are very long, as is my commute, so I need to have all my stuff with me. 

Any ideas?",2025-04-04 18:31:06+00:00,4,5
1jrhu4p,handbags,"In search of similar bags that are shaped like this, & structured, medium size.","I got this bag from JCPenney and love the shape and size. But I’m not into any of the other shades it comes in. Any similar bags out there? I have the Coach Juliet already as well.  

Budget around $300, in USA ",2025-04-04 17:40:12+00:00,2,5
1jren8p,handbags,What I was carrying a decade+ ago …,"Cleaning out my closet and having a laugh. Totally thought I was hot shit carrying some of these. Pretty sure I’d only carry the fossil clutch today?

Back a decade (or more) ago, I was rocking Dooney & Burke outlet, Coach outlet, Michael Kors, Kate Spade SATURDAY, and Fossil. 

I’m sure there were some Target and Francesca bags mixed in that didn’t survive 😅",2025-04-04 15:27:19+00:00,138,67
1jr8udj,handbags,Coach Mila vs Evie?,"For a wedding gift for my future MIL! We want to get her a nice bag she can use at the wedding (our wedding color is baby blue and her dress is blue) and afterwards. She always carries a big wallet but it doesn’t fit her phone and she’s always leaving it places accidentally lol, so was hoping to find something that works as a wallet that also holds her phone AND has a strap. 

Biggest differences:

The Mila has a removable wallet insert, the Evie has built-in card slots. 
Mila is .25 inches wider and .75 inches taller, but Evie is half an inch deeper. 
Evie is calf leather, Mila is pebble leather

They’re the exact same price and VERY similar, so looking for opinions! ",2025-04-04 10:41:41+00:00,5,2
