id,subreddit,title,selftext,time,score,num_comments
1jeu3fy,handbags,Demellier New York vs. Coach Empire Carryall,"Y’all! I just got my bonus payout and after some bills and stuff have been taken care of, I now find myself at an impasse regarding how to treat myself! 

So I’m coming to the experts! Between the Demellier London New York and the Coach Empire Carryall, Which would you choose, and why??

",2025-03-19 10:44:26+00:00,6,8
1jerpra,handbags,Which one should I get?,"I been looking for a black shoulder bag that can look good with any outfit. 

I been eyeing TB, Coach, Strathberry and Demellier but I have doubts about the quality of the TB and Demellier. Strathberry multress omni is beautiful but haven’t seen anyone talking about this bag and I’m not sure about the leather ",2025-03-19 07:42:59+00:00,24,43
1jepaq8,handbags,Need Opinions Please 😇,"I need advice on what to do and deciding between two bags.
So a couple months ago I bought a previously owned large YSL SDJ bag. Classic black, studded strap, in near perfect condition. But I’m kinda having second thoughts about it. The bag is beautiful and it’s a classic bag but I just don’t know.
It might sound crazy but I’m thinking of reselling it and purchasing the Coach Rogue 39. I’ve been thinking about that bag for a WHILE but I would prefer to customize with charms and chains, all the fun stuff to make it personalized.
Both bags are my style and about the same size. The YSL would be a great work bag and forever chic but I think the Coach is a more everyday style, but I’m also thinking I might be influenced by the trend over something timeless?
Or do I do both? That’s always an option lol
Please feel free to share all the ideas! They’re greatly appreciated! I included pictures for a reference 😇",2025-03-19 04:46:55+00:00,14,21
1jelnz4,handbags,The bags I use most frequently,"Love my little collection. I spent the day cleaning and caring for the leather on these bags. I love how with a little elbow grease leather can look brand new. 

Some of these I’ve used and abused and had for years!! If you are neglecting a bag in your collection due to it looking like it’s on its last legs take some time to clean her up and you’ll see it have a new life. 

These are all coach other than a jacquemus (white) and ysl. I currently have purse peace but it may not last long lol. ",2025-03-19 01:25:42+00:00,177,37
1je7gef,handbags,Help me pick mini Carmen or Teri shoulder bag,"The cherry print caught my eyes when I walked into the coach store. I wonder which one is better! Teri has more space/storage but the shape of mini Carmen is so cute 
",2025-03-18 15:20:41+00:00,9,6
1je5hhp,handbags,Claudia Firenze Find,"I’ve had the Coach Brooklyn 39 in suede cedar on my wishlist and was able to fulfill that wish with this bag at a fraction of the cost. It’s slouchy, stylish and smells like leather.",2025-03-18 13:53:47+00:00,52,4
1je5ebi,handbags,Which bag should I get?,"I have been obsessed over the coach Brooklyn for too long. And now I decided I am gonna get it. 
Now, I need to choose a color for my new everyday bag😆

Im obsessed with the suede but at the same time idk if is harder to keep clean and pretty?🥹 
Buying a $300 bag is a lot for me and I want to make the right decision! 
Thank y’all! 
",2025-03-18 13:49:42+00:00,3,4
1je1mq9,handbags,My wishlist - any adds? Any reviews?,"I spent the weekend to make a list of bags that I could imagine to buy in the future.
If you have any ideas which bags with similar vibes I should add, please feel free to recommend them :)
Also, if you own any of the bags: How are the holding up? Would you buy them again/recommend them?

All of my current bags are brown or black, so really thinking about adding colors as well. Any of the bags pictured that you would recommend with a pop of color?

Bags pictured (hopefully I get them right haha):
- Ferragamo Hug
- Celine 16
- Coach Empire Carryall 34
- YSL 5 a 7 tote
- YSL Manhattan
- Celine Ava Shoulder bag
- Coach Brooklyn Hobo Bag
- YSL 5 a 7 shoulder bag
- Gucci Jackie
- Celine Teen",2025-03-18 10:16:04+00:00,81,44
1jdy2ik,handbags,Been eyeing the coach Rogue for years. Finally got her. No regrets 😍,"Coach rogue in glovetanned leather “Rogue bag with Rivets” 

Length: 12.25""
Height: 9.75""
Width: 6.0""

I typically prefer bags that don’t have any logos so this one is perfect because there are no visible logos. I got this for 60% off!!!",2025-03-18 05:40:02+00:00,99,15
1jdunjx,handbags,Which one would you pick?,"Which one would you choose from the options below, and why?

Here are the prices:
- Juliet Shoulder Bag in Honey Brown – USD 346
- Lana Shoulder Bag in Burnished Amber – USD 295
-Soft Tabby Shoulder Bag in Ivory (with some flaws/spots) – USD 212


",2025-03-18 02:18:54+00:00,23,38
1jdt5bs,handbags,Anyone have experience with Dyeing bags?,"I have this old Coach Mini Bennett bowling bag and haven’t reached for it in years because of the color. I was wondering if anyone’s had experience with dyeing their bags (I will be taking it to a professional) ? I’m thinking a darker, cool toned brown, navy, or forest green. Would love your opinions! ",2025-03-18 01:03:56+00:00,4,6
1jds7ha,handbags,Anyone have experience with this brand? Or another suggestion?,"Hi! I am on the hunt for an everyday bag that I can wear over my shoulder and holds a lot. I don’t typically like compartments - and I’m 5’1 so anything shaped too long looks ridiculous on me. I found this bag, but have never heard of this brand before. Anyone have experience with it? Or can recommend a different bag that is a similar shape? I am wanting to stay around the $600-less mark, and want a good quality leather that looks and feels nice. I’ve tried the coach rogue, and while it’s gorgeous, it just doesn’t work for me with the compartments and the shape of the bag being so square. ",2025-03-18 00:18:14+00:00,4,3
1jdor75,handbags,Coach denim,,2025-03-17 21:44:38+00:00,7,2
1jdhv58,handbags,"Recommendations for <$100 daily crossbody, understated/classy, that does almost everything and lasts a long time?","This might be a tall order! The only ""proper"" bag I've owned was a classic leather Coach flap bag from when I was a teenager and I unfortunately no longer have it. I think it would have lasted a lifetime. Since then, I haven't actually purchased any aside from random ""sporty"" nylon crossbody bags but I'm definitely pushing it for dressy casual outings, and none of them seem to hold up. I am not really into luxury brands or loud logos, but if this price range isn't possible for something that will last a very long time, I'm willing to spend a bit more. I would prefer something black, classy, simple, and structured, that can go with classic dressier outfits. I looked at Quince but heard mixed reviews on quality. Any suggestions welcome!",2025-03-17 17:08:44+00:00,1,9
1jdhlnd,handbags,Love at first sight 🥰,Scrolling the coach website Friday evening saw this bag and instantly added it to my cart and checked out 😆. It was just delivered by ups and I am 1000% obsessed 😍.,2025-03-17 16:58:48+00:00,21,3
1jdha0u,handbags,Any advice for how to fix this red bag?,"I got it at an estate sale for my mom, I conditioned it and she’s used it for a few months. Is it something she’s doing? Does the bag need to be redyed?",2025-03-17 16:45:38+00:00,5,3
1jdd3mf,handbags,Work + weekend bag in one?,"Hello, I'm looking for recommendations for a shoulder bag that can function as both a work bag and weekend bag. I have a convertible backpack that can hold everything I need no matter where I go, but I'm looking for something dressier and cuter. While I do have bags that work very nicely for work or weekend (but not both), I've recently been finding it a little cumbersome to move my things from bag to bag depending on the day (in other words, I'm lazy). I'm looking for a good quality and durable shoulder bag that's spacious, not too heavy, and has various compartments/pockets. I'm open to using pouches or an insert to organize the contents if there are no/limited compartments/pockets. Some things I would like to have but don't absolutely need are some type of closure at the top, feet, gold hardware over silver.

For work, I need to hold a 14"" laptop, water bottle, small wallet, and makeup pouch. For weekend (or errands), I need to hold various kid items (water bottles, snacks, little toys, sweaters) plus my own small wallet and makeup bag.

My budget is up to $700, preferably closer to $500 or less, but I would consider spending up to $700 for a very good quality bag that checks all the boxes. Two bags I'm considering are Kate Spade's large deco shoulder bag and Coach's Brooklyn 39 bag (see links below), but I would love to hear other ideas (or feedback about these two bags).

https://www.katespade.com/products/deco-large-shoulder-bag/KI556.html?frp=KI556+UMH&fromSearch=Deco%20large

https://www.coach.com/products/brooklyn-shoulder-bag-39/CU044-B4PUB.html

I apologize for the long post and for any mishaps with formatting or following rules (posting is very new for me). Thank you so much for reading this post and for any recommendations you can provide!",2025-03-17 13:50:47+00:00,2,4
1jdcxi6,handbags,Help me pick out which bag to tell my hubby for Mother’s Day 💗🫣,"I already have sort of a variety of Louis Vuitton, Chanel and several coach bags in neutrals, but I wanted to add some other brands to my collection for Mother’s Day coming up. Help me pick one ☺️

I’m really looking for a slouchy style bag. 

I absolutely love the Celine or the Loewe. 🥹",2025-03-17 13:42:39+00:00,57,209
1jdcntx,handbags,I'm looking for a green shoulder bag. Which are your faves?,"I've been looking for a green shoulder bag, preferably a warm green. Mid luxury leather bags only, please! Right now, I'm liking the green quilted tabby, but I don't like the green C, I heard it peels really soon

https://preview.redd.it/5du6jkv159pe1.png?width=1600&format=png&auto=webp&s=7f42ff4a5a7aa7dbcf2bc212f73506c36f22d1e9

",2025-03-17 13:29:59+00:00,3,3
1jd6vg8,handbags,Which one should I buy?,"I’ve had my eye on this local brand from Indonesia that uses Italian leather. Which model do you think is the best?

I don’t own many bags, just some tote bags, a The Horse Clementine, and a Coach Soft Tabby for now. Thank you!",2025-03-17 07:10:32+00:00,17,37
1jcy7gr,handbags,New (unexpected) work bag has landed!,"I've been looking for a new professional bag to carry my laptop and other essentials for work. Ideally I wanted something that didn't just scream ""tote bag"" and didn't look like luggage. You know, with a little style. I also prefer something more structured than slouchy for this. 

I hadn't even considered the Coach Lana when poking around online. In photos it looked bulky and yet also as though my laptop might not fit. I only looked more closely once the SA pointed it out as an option.

It's actually kind of perfect! Extremely roomy (I swear Coach bags have some TARDIS magic so they're bigger on the inside--my Cassie 19 is the same way), yet it looks more like a large purse than a briefcase. I already adore it! I already had the pear charm and I think it looks fabulous here.

Cookie insisted on inspecting the new arrival as well--and she approves. Otherwise she wouldn't deign to sit near it. 😊

",2025-03-16 22:57:55+00:00,214,36
1jcy0yx,handbags,Bag suggestion for Mum,"Hello everyone! First time posting but I've been lurking for a while and loving everybody's beautiful collections.

I wanted to get some suggestions about a possible designer bag I can purchase for my mum from my first salary. I'm south east asian and it's a lovely tradition to buy items for your parents from your first paycheck. Years ago I promised myself I'd get my mum a bag that she'd never choose to get herself since she'd rather spend that money on her family - so here I am now : )

My budget is around 4.5K AUD, though I can extend a little if needed. Ideally will try limit it though because the more expensive the bag, the more difficulty I'll have getting mum to accept it. I'm in Melbourne, Australia and would prefer to buy locally. While I do love supporting more indie or niche houses, for this bag I'm looking at the big designers to fulfill my promise.

Requirements are: 
- Designer house, can be purchased in Australia
- In 4.5K AUD range (potentially a little more if neccesary)
- Top handle, structured handbag
- Balanced size wise for a petite person
- Neutral shade to be used with multiple outfits
- Leather 
- Optional, but some sort of closure/zip for security 

Currently considering these beige nano sac de jour's from YSL - would love to hear some experiences with these as well. I'm also happy to answer any additional questions like the bags and colours she already has from brands like coach etc.
",2025-03-16 22:49:30+00:00,9,9
1jcwx3e,handbags,Estate Sale Finds!!,"Hit up some estate sales yesterday and came away with what I think is a decent little haul. I'm not sure what is or isn't considered ""luxe"" or fancy but I wouldn't pay full price for any of these in normal shopping settings so I consider it a win! 

I found: 
Coach wristlet
Coach Crossbody 
Loungefly Puppy backpack
Tory Burch Emerson Satchel 
Ted Baker black bag 

I'm having the backpack and wristlet for when my one year old gets older 😊",2025-03-16 21:59:01+00:00,16,2
1jcv995,handbags,Swing zip or Brooklyn?,Swing zip (1) or Brooklyn (2)?,2025-03-16 20:44:16+00:00,1,5
1jcr87p,handbags,Tiffany and Fred appear to have a dupe of the Coach Kisslock available!,,2025-03-16 17:51:21+00:00,2,3
1jcr49n,handbags,"OK, I’ve been converted into a coach girlie!",,2025-03-16 17:46:32+00:00,106,18
1jcqd2r,handbags,Help needed!,"Okay here are my choices for a new bag and my feelings on each. I need an everyday bag that can fit basic essentials (phone, small wallet, small makeup pouch) plus occasionally one of my kids’ water bottles or a change of clothes, etc. Would love any input on these options!

1. Love the way this one looks and the color. Not sure about the strap and kind of think it looks messy being adjustable. 
2. Like the shape and lack of branding. Worried the color is too light and will get messy since the leather is smooth. Also wondering if it will be hard to get into with the shape. 
3. Probably the front runner that I keep coming back to. Wish the color was slightly less orange but otherwise seems great. 
4. I just really love this bag and think it’s so cute. I’m not crazy about the color (I really love the brown suede version but I don’t want to be limited to when I can use it). It’s probably not as practical and I can’t really figure out the true size so may not be big enough for me. Talk me out of it😂
5. Feel like this is similar style but not as cute as the longchamp but if it’s way better I could be convinced. 
6. Love the color. Not crazy about the logo on the front even though it’s small. Again feel like it may be hard to get into. ",2025-03-16 17:14:05+00:00,12,15
1jcp4le,handbags,Trying to remember a studded crossbody popular in the mid 2010's (2012-2017),"Going by memory: It was a crossbody, hard leather, and studded trim. Sometimes black studs, but also silver. Leather was often black, but available in other bright colours as well (if memory serves). Cant remember if it came in different sizes, but the one I remember was a medium....not a tote, but also not a clutch.

Lots of the rock/alternative bloggers of the time would have the bag, or bags from the line. In Canada, you could find the bag at The Bay and Nordstorm for $200-$300.

NOT Coach, Ted Baker, Tory Birch, Kate Spade, or All Saints (100% fits All Saints vibe though). Feel like the name of the brand/line started with an 'A' (was a name), but also feel like it may have started with an 'M' as well?

Any leads would be awesome. 💗

Eta: not Alexander Wang, Marc Jacobs, or McQueen 

ETA2: Found! It was Rebecca Minkoff 😊",2025-03-16 16:20:30+00:00,2,12
1jcp4d8,handbags,My accidental haul this week 😆,"I'm in budget mode and did NOT expect to buy a new bag this week, much less three! 

But I've been looking for the *perfect* red bag for like a year now, and I finally found THE ONE and it was only $80! It's a patent leather Pratesi that's definitely a made-for-outlets version of their Barchetta bag. But I honestly wouldn't want to pay more for a patent leather bag because of the inevitable scuffs and scratches. This one is real leather at least, and I found a patent leather conditioner by Saphir I'm going to order asap to try to keep it in good shape, but I know it's not going to be pristine forever no matter what I do. 

I took my mom purse shopping at Marshall's the very next day and I found this super fun cherry print straw bag by Betsey Johnson for $25! As you can probably guess from the picture, cherries are pretty much my ""thing"" and I will happily rock this little cutie all summer. 

And finally, the Coach Teri bag in chalk white cherry print. I have been eyeing this bag, the Florence sandal, and the diamond silk scarf in this cherry print since the day they came out. 😍😍😍😍😍😍😍😍😍😍

My husband and I were shopping for his brother's birthday present when I made a joke about needing him to keep me out of the Coach Outlet as we were passing it, so then of course we immediately went inside. 🤣 

I obsessively showed him every single accessory with the cherry print until we finally made it to the back where they had like 4 bags with the print in chalk. They're 60% off now so I snagged the Teri bag for $160! 

I had been behaving myself for MONTHS trying to convince myself I didn't need it. But when I finally held it in my hands I knew I'd kick myself forever if I didn't grab it, especially at that price. 

Yesterday I looked online one more time at the diamond silk scarf and there was exactly ONE left on Amazon and every other site I looked at was already sold out. So yup, I grabbed the scarf too! 🤣 

Now about those sandals... 😬",2025-03-16 16:20:13+00:00,25,6
1jcng31,handbags,That Girl,"I'm about to be one of those girls who asks for a pick between 2 pretty different bags. Except are they really? Both d&b leather/florentine bucket bags. Not the same palette.  

I am a Coach girlie, with plenty of British tan bags. That said, the striations on this brown Dooney are just SO gorgeous. And I love feet. But .... is it old lady? And how many literal brown purses can a person own? 

Now the is it blue?is it grey?is it purple? bag -- I don't know what my questions are. Will it fade or get discolored from denim? Is it also old lady? Can it be carried for more than just spring and summer? 

I'm confident in my taste and quality. I'm also solidly middle age but don't feel like an adult. 

You don't have to pick for me but I'd love opinions. Even if they're mean.",2025-03-16 15:05:12+00:00,59,29
1jck2x0,handbags,Help me find a bag!,"Hi everyone! I'm trying to find a bag that was posted here recently, maybe a few days ago? I was so silly and didn't save the post, and now I can't find it! I really wanted to ID it. If I remember right, it was black, kind of like the Coach Brooklyn shape, and had integrated straps that were long enough for crossbody. Does anyone remember seeing that post, or can you recommend a bag like that? I'd be so grateful for any help!",2025-03-16 12:11:19+00:00,4,7
1jcdbr2,handbags,Help me pick a casual tan leather bag,I’m having a hard time choosing between these bags. I don’t carry a lot of stuff when I’m out on the weekends so the last one is probably too big. The first one is a Coach and last two are Tod’s. Does anyone have any of these bags or what would you pick for someone who wears a lot of navy and black Tshirt and shorts? 😆,2025-03-16 04:09:06+00:00,4,9
1jcd07u,handbags,Does anyone have a purse repair person / company they trust? (Coach),"I have a coach bag that was a hand-me-down from my mom. unfortunately, she gave it to me in my early teen years and it’s been through a lot. I still love the bag and the fact it was my mom’s, and would love to pay to get it repaired. It would need stain removal as well as leather repairs. I understand that Coach does not do either of those services with their company repairs. Does anyone have a purse repair person/company that could fix it? 

Thank you! ",2025-03-16 03:50:25+00:00,2,4
1jc3c92,handbags,Which one do I wear?,"Excuse my absolute chicken legs 🐥 but which bag should be my BOTD?!? My vintage speedy (I’m using a shoulder strap from one of my other LV bags, I know it’s not recommended but I never plan on stuffing this bag to the brim), OR my new Coach Kisslock Clutch?!? I’ve been loving the clutch lately. ",2025-03-15 19:43:02+00:00,10,33
1jc056z,handbags,Brown east-west style bags?,"Interested in a brown east-west style bag…ideally no large logos or hardware…

The Coach swing zip was my original inspiration, but I prefer the lack of hardware on the Freja and Marge Sherwood. The Marge Sherwood logo is a bit much…the Freja is almost perfect but not sure how I feel about vegan leather. 

Are there any other similar options?",2025-03-15 17:21:04+00:00,5,5
1jbz9xm,handbags,Got It!!,,2025-03-15 16:43:45+00:00,37,5
1jbwvbh,handbags,Can’t decide to keep or return Halston handbag.,"I got this at Marshall’s for $50. I like that it is very light and smaller than my coach bag (but I switch up bags all the time). It does hold all my stuff, including a beefy wallet. Is it worth it? The stitching on the outside pocket is getting me though. Keep or return?",2025-03-15 14:55:12+00:00,12,11
1jbmfhb,handbags,"Do not pass go, run to Coach in Singapore for Tabby popsicles",This is the absolute cutest. https://www.instagram.com/reel/DG5K5oLzFrT/?igsh=NTc4MTIwNjQ2YQ==,2025-03-15 03:44:37+00:00,149,7
1jbiti6,handbags,Smooth leather coach Klare,,2025-03-15 00:29:57+00:00,0,1
1jbf71j,handbags,been building my luxury collection … thought i’d share!,"L-R: Loewe Puzzle (small, pearl grey), Burberry Knight (medium, black, shearling), Saint Laurent Sac De Jour (small, cinnamon, supple leather), Celine Teen Soft 16 (teen, tan), Bottega Veneta Chain Cassette (red, suede), Fendi Baguette (medium, dark blue, chenille), Valentino Roman Stud Flap (large, jungle)

the Puzzle is my daily driver, as you can tell with all the charms lol. next on my list is to add a white and a yellow bag. ideally, i’ll eventually add orange, purple and pink bags as well, but those aren’t as high on my list of priorities. i want my luxury collection to be a mix of classic/timeless pieces, as well as some bolder, trendier pieces since that fits my wardrobe well as a gay late 20-something. i also wanted a variety in terms of textures (shearling, jacquard, suede, large hardware) and patterns (the zucca print). i have two crossbodies, one hobo, three flaps and a structured tote, so i’m looking to add more unique silhouettes.

i only want one bag from each brand until i have fleshed out my bases, and the next brands i’ve been looking at are Prada (i really enjoy their bags in the triangle shapes), Ferragamo (specifically the Hug bag), and something from one of the gaudier brands (Balmain’s new stuff looks really cool) but i’m a huge stickler for quality. i was really impressed by the quality of all these bags after being used to Coach’s more expensive bags for a long time, but brands like Balenciaga and Versace’s handbag quality really disappointed me when i handled them in person. to my surprise, the Burberry is absolutely the best quality bag of all of these pictured; they might be having an identity crisis right now, but the build quality is absolutely amazing. only the Sac De Jour comes close. 

feel free to ask any questions if you want more insight into any of these bags!",2025-03-14 21:42:55+00:00,164,22
1jbcfs9,handbags,vivienne westwood granny frame,"ft. a marc jacobs chain and coach star coin purse to dress her up and inside i have some cosmetics, etc inside a baggu pouch, a coach wallet, le specs sunglasses and a glossier mirror :’)",2025-03-14 19:43:55+00:00,29,2
1jbcdqc,handbags,Smaak Figu,"I got this today in Camel. I’m a big Coach (and one HAMMIT!) girl, so maybe I’m just used to great leather…but the leather on this Smaak bag was not it! Not very soft at all. I was disappointed with that. I will say the lining is so, so soft. Hardware is really nice. 

It’s got the longest crossbody strap I’ve ever seen, lol. It’s not love for me, and I am definitely returning it. Also, the opening/zipper does not go down in front as it appears (something that was unclear on the website). It’s hard to fit my iPhone 15 Plus in the opening, and even with minimal items in the bag, my phone doesn’t fit with my stuff. 

Meh!!! I did get a beautiful Coach Small Alter/Ego in black today, though. I posted her in the Coach subreddit. I’m obsessed with that bag and it’s beautiful leather! 🥰",2025-03-14 19:41:37+00:00,12,2
1jbboxm,handbags,Worth the wait!,"I’ve been waiting for the restock of the carryall 40 in maple and it was totally worth it 🥳 I love the color, the size, the feel! My first big girl bag and I’m so happy!",2025-03-14 19:12:49+00:00,28,6
